{
  "schema": "agent-memory-production-launch-assets-input-v1",
  "classification": "production_external",
  "environment": "production",
  "review_id": "launch-assets-2026-08",
  "manifest_version": "manifest-v1",
  "probe_version": "probe-v1",
  "copy_review_version": "copy-v1",
  "monitoring_review_version": "monitor-v1",
  "inventory_id": "replace-with-production-inventory-id",
  "inventory_receipt_sha256": "aaaaaaaaaaaaaaaaaaaaaaaaaaaaaaaaaaaaaaaaaaaaaaaaaaaaaaaaaaaaaaaa",
  "plan_id": "replace-with-production-plan-id",
  "plan_receipt_sha256": "bbbbbbbbbbbbbbbbbbbbbbbbbbbbbbbbbbbbbbbbbbbbbbbbbbbbbbbbbbbbbbbb",
  "change_id": "replace-with-production-change-id",
  "change_receipt_sha256": "cccccccccccccccccccccccccccccccccccccccccccccccccccccccccccccccc",
  "release_id": "replace-with-production-release-id",
  "release_receipt_sha256": "dddddddddddddddddddddddddddddddddddddddddddddddddddddddddddddddd",
  "manifest_sha256": "eeeeeeeeeeeeeeeeeeeeeeeeeeeeeeeeeeeeeeeeeeeeeeeeeeeeeeeeeeeeeeee",
  "accountable_review_sha256": "ffffffffffffffffffffffffffffffffffffffffffffffffffffffffffffffff",
  "snapshot_at": "2026-08-10T17:56:00Z",
  "reviewed_at": "2026-08-10T17:58:00Z",
  "generated_at": "2026-08-10T17:59:00Z",
  "ready": true,
  "assets": [
    {"id":"external_signup","owner_group":"product","public_url_sha256":"1111111111111111111111111111111111111111111111111111111111111111","rendered_copy_sha256":"2111111111111111111111111111111111111111111111111111111111111111","monitoring_config_sha256":"3111111111111111111111111111111111111111111111111111111111111111","route_test_sha256":"4111111111111111111111111111111111111111111111111111111111111111","owner_decision_sha256":"5111111111111111111111111111111111111111111111111111111111111111","observed_at":"2026-08-10T17:55:00Z","http_status":200,"probe_count":3,"successful_probe_count":3},
    {"id":"terms_of_service","owner_group":"product_counsel","public_url_sha256":"1222222222222222222222222222222222222222222222222222222222222222","rendered_copy_sha256":"2222222222222222222222222222222222222222222222222222222222222222","monitoring_config_sha256":"3222222222222222222222222222222222222222222222222222222222222222","route_test_sha256":"4222222222222222222222222222222222222222222222222222222222222222","owner_decision_sha256":"5222222222222222222222222222222222222222222222222222222222222222","observed_at":"2026-08-10T17:55:00Z","http_status":200,"probe_count":3,"successful_probe_count":3},
    {"id":"privacy_notice","owner_group":"product_counsel","public_url_sha256":"1333333333333333333333333333333333333333333333333333333333333333","rendered_copy_sha256":"2333333333333333333333333333333333333333333333333333333333333333","monitoring_config_sha256":"3333333333333333333333333333333333333333333333333333333333333333","route_test_sha256":"4333333333333333333333333333333333333333333333333333333333333333","owner_decision_sha256":"5333333333333333333333333333333333333333333333333333333333333333","observed_at":"2026-08-10T17:55:00Z","http_status":200,"probe_count":3,"successful_probe_count":3},
    {"id":"content_rights_policy","owner_group":"product_counsel","public_url_sha256":"1444444444444444444444444444444444444444444444444444444444444444","rendered_copy_sha256":"2444444444444444444444444444444444444444444444444444444444444444","monitoring_config_sha256":"3444444444444444444444444444444444444444444444444444444444444444","route_test_sha256":"4444444444444444444444444444444444444444444444444444444444444444","owner_decision_sha256":"5444444444444444444444444444444444444444444444444444444444444444","observed_at":"2026-08-10T17:55:00Z","http_status":200,"probe_count":3,"successful_probe_count":3},
    {"id":"status_page","owner_group":"operations","public_url_sha256":"1555555555555555555555555555555555555555555555555555555555555555","rendered_copy_sha256":"2555555555555555555555555555555555555555555555555555555555555555","monitoring_config_sha256":"3555555555555555555555555555555555555555555555555555555555555555","route_test_sha256":"4555555555555555555555555555555555555555555555555555555555555555","owner_decision_sha256":"5555555555555555555555555555555555555555555555555555555555555555","observed_at":"2026-08-10T17:55:00Z","http_status":200,"probe_count":3,"successful_probe_count":3},
    {"id":"support_policy","owner_group":"support_operations","public_url_sha256":"1666666666666666666666666666666666666666666666666666666666666666","rendered_copy_sha256":"2666666666666666666666666666666666666666666666666666666666666666","monitoring_config_sha256":"3666666666666666666666666666666666666666666666666666666666666666","route_test_sha256":"4666666666666666666666666666666666666666666666666666666666666666","owner_decision_sha256":"5666666666666666666666666666666666666666666666666666666666666666","observed_at":"2026-08-10T17:55:00Z","http_status":200,"probe_count":3,"successful_probe_count":3},
    {"id":"security_contact","owner_group":"security","public_url_sha256":"1777777777777777777777777777777777777777777777777777777777777777","rendered_copy_sha256":"2777777777777777777777777777777777777777777777777777777777777777","monitoring_config_sha256":"3777777777777777777777777777777777777777777777777777777777777777","route_test_sha256":"4777777777777777777777777777777777777777777777777777777777777777","owner_decision_sha256":"5777777777777777777777777777777777777777777777777777777777777777","observed_at":"2026-08-10T17:55:00Z","http_status":200,"probe_count":3,"successful_probe_count":3}
  ],
  "checks": [
    {"id":"launch_asset_manifest_complete","outcome":"passed","evidence_sha256":"6111111111111111111111111111111111111111111111111111111111111111"},
    {"id":"immutable_copy_review_complete","outcome":"passed","evidence_sha256":"6222222222222222222222222222222222222222222222222222222222222222"},
    {"id":"live_probe_coverage_complete","outcome":"passed","evidence_sha256":"6333333333333333333333333333333333333333333333333333333333333333"},
    {"id":"asset_ownership_complete","outcome":"passed","evidence_sha256":"6444444444444444444444444444444444444444444444444444444444444444"},
    {"id":"monitoring_routes_tested","outcome":"passed","evidence_sha256":"6555555555555555555555555555555555555555555555555555555555555555"},
    {"id":"product_review_complete","outcome":"passed","evidence_sha256":"6666666666666666666666666666666666666666666666666666666666666666"},
    {"id":"counsel_review_complete","outcome":"passed","evidence_sha256":"6777777777777777777777777777777777777777777777777777777777777777"},
    {"id":"support_review_complete","outcome":"passed","evidence_sha256":"6888888888888888888888888888888888888888888888888888888888888888"},
    {"id":"security_review_complete","outcome":"passed","evidence_sha256":"6999999999999999999999999999999999999999999999999999999999999999"}
  ]
}
